{
  "schemaVersion": "location-bible-return-to-codex-v1",
  "handoffId": "location-bible-example-not-for-production",
  "returnStatus": "DRAFT",
  "locationId": "loc-example",
  "candidates": [
    {
      "taskId": "example-location-master-panorama",
      "componentType": "MASTER_PANORAMA",
      "candidateId": "example-candidate-not-generated",
      "expectedFileName": "example_location_master_panorama_candidate.png",
      "localFilePath": null,
      "userDecision": "PENDING_USER_REVIEW",
      "userDecisionReason": "No candidate has been generated; this is example-only.",
      "driftFindings": [],
      "sourceConversationNote": "Record the exact conversation and candidate without private URLs or credentials.",
      "sourceFileSha256": null,
      "intakeStatus": "PENDING_FILE_TRANSFER",
      "nextRequiredCliStages": [
        "validate-image-candidate-external-result-intake",
        "validate-image-candidate-result-review-preflight",
        "validate-image-candidate-result-human-review-decision",
        "create-image-candidate-reference-packet",
        "validate-image-candidate-reference-packet",
        "validate-candidate-reference-human-acceptance-decision",
        "validate-candidate-reference-registry-preflight",
        "create-candidate-reference-registry-packet",
        "validate-candidate-reference-registry-packet",
        "validate-candidate-reference-registry-human-acceptance-decision",
        "create-candidate-reference-acceptance-packet",
        "validate-candidate-reference-acceptance-packet"
      ]
    }
  ],
  "intakeBoundary": {
    "approvalAppliesToExactCandidateOnly": true,
    "sourceFileSha256RequiredAfterCodexReceivesFile": true,
    "existingExternalResultHumanReviewAndCandidateReferenceStagesRequired": true,
    "approvalDoesNotWriteCanonOrSqlite": true,
    "locationReferenceAcceptanceDoesNotApproveStoryShotsOrFinalMedia": true
  },
  "exampleOnly": true
}
